<?xml version="1.0" encoding="windows-1251"?>
<xs:schema xmlns:xs="http://www.w3.org/2001/XMLSchema">
	<xs:annotation>
		<xs:documentation>Запит щодо надання інформації про відсутність або наявність заборгованості (податкового боргу) із сплати податків, зборів, платежів, контроль за якими покладено на органи Державної фіскальної служби, в учасника процедури закупівлі</xs:documentation>
	</xs:annotation>
	<xs:include schemaLocation="common_types.xsd"/>
	<xs:element name="DECLAR" type="DeclarContent"/>
	<xs:complexType name="DeclarContent">
		<xs:sequence>
			<xs:element name="DECLARHEAD" type="DHead"/>
			<xs:element name="DECLARBODY" type="DBody"/>
		</xs:sequence>
	</xs:complexType>
	<xs:complexType name="DHead">
		<xs:sequence>
			<xs:element name="TIN" type="DGLong"/>
			<xs:element name="C_DOC" type="xs:string" fixed="J16"/>
			<xs:element name="C_DOC_SUB" type="xs:string" fixed="031"/>
			<xs:element name="C_DOC_VER" type="xs:string" fixed="1"/>
			<xs:element name="C_DOC_TYPE" type="xs:nonNegativeInteger"/>
			<xs:element name="C_DOC_CNT" type="xs:nonNegativeInteger"/>
			<xs:element name="C_REG" type="DGsti"/>
			<xs:element name="C_RAJ" type="DGsti"/>
			<xs:element name="PERIOD_MONTH" type="DGMonth"/>
			<xs:element name="PERIOD_TYPE" type="DGPType"/>
			<xs:element name="PERIOD_YEAR" type="DGYear"/>
			<xs:element name="C_STI_ORIG" type="DGc_dpi"/>
			<xs:element name="C_DOC_STAN" type="DGSTAN"/>
			<xs:element name="LINKED_DOCS" nillable="true" minOccurs="0">
				<xs:complexType>
					<xs:sequence>
						<xs:element name="DOC" maxOccurs="unbounded">
							<xs:complexType>
								<xs:sequence>
									<xs:element name="C_DOC" type="DGC_DOC"/>
									<xs:element name="C_DOC_SUB" type="DGC_DOC_SUB"/>
									<xs:element name="C_DOC_VER" type="DGC_DOC_VER"/>
									<xs:element name="C_DOC_TYPE" type="xs:nonNegativeInteger"/>
									<xs:element name="C_DOC_CNT" type="xs:nonNegativeInteger"/>
									<xs:element name="C_DOC_STAN" type="DGSTAN"/>
									<xs:element name="FILENAME" type="DGFilename"/>
								</xs:sequence>
								<xs:attribute name="NUM" type="xs:nonNegativeInteger"/>
								<xs:attribute name="TYPE" type="DGTypeLinkDoc"/>
							</xs:complexType>
						</xs:element>
					</xs:sequence>
				</xs:complexType>
				<xs:unique name="UH_DOC_NUM">
					<xs:selector xpath="DOC"/>
					<xs:field xpath="@NUM"/>
				</xs:unique>
			</xs:element>
			<xs:element name="D_FILL" type="DGDate"/>
			<xs:element name="SOFTWARE" type="xs:string" nillable="true" minOccurs="0"/>
		</xs:sequence>
	</xs:complexType>
	<xs:complexType name="DBody">
		<xs:sequence>
			<!--HEAD-->
			<xs:element name="HNUM" type="xs:unsignedLong"/>
			<xs:element name="HNAME" type="DGHNAME"/>
			<xs:element name="HTIN" type="DGHTINJ"/>
			<xs:element name="HKSTI" type="DGc_dpi"/>
			<xs:element name="HSTI" type="DGHSTI"/>
			<!--BODY-->
			<xs:element name="R0101G1S" type="DGstring"/>
			<xs:element name="R0201G1S" type="DGLong"/>
			<xs:element name="R0202G1S" type="xs:string" nillable="true" minOccurs="0"/>
			<xs:element name="R0203G1S" type="xs:string" nillable="true" minOccurs="0"/>
			<xs:element name="R0204G1S" type="xs:string" nillable="true" minOccurs="0"/>
			<xs:element name="R0205G1S" type="xs:string" nillable="true" minOccurs="0"/>
			<!--FOOTER-->
			<xs:element name="HFILL" type="DGDate"/>
			<xs:element name="HTIME" type="xs:time"/>
		</xs:sequence>
	</xs:complexType>
</xs:schema>
